rank,target_customer,pain_cluster,problems_solved,pl_opportunity_score,unique_selling_proposition,suggested_product,product_description,unmet_need,co_occurring_problems,why_co_occur,market_demand,existing_solutions,intensity_score,frequency_score,solution_gap_score,addressable_market,brandability,subscription_signal,source_categories,customer_description
1,The Self-Image Professional,The Daily Coffee–Stain Loop,3,100,"The only whitening system designed for coffee drinkers, not despite them. Whiten your teeth in the same time it takes to make your morning cup.",Morning Ritual Whitening System,A 3-step system built around the coffee drinker's morning: (1) a pre-coffee enamel shield tablet that reduces binding of tannins for 4 hours; (2) a 5-minute low-peroxide whitening pen used after the l,"A micro-dose daily whitening habit that fits inside the coffee routine — not replacing it, not fighting it.",Coffee stains teeth progressively despite twice-daily brushing | Results fade within 2–3 weeks of stopping treatment | Daily brushing alone is insufficient between coffee cups,These three problems occur because coffee is consumed daily but treatment is periodic. No product currently addresses daily stain maintenance AS PART OF the coffee ritual.,~$1.8B US oral beauty,Amazon commodity products — 83% suspicious review rate,88,95,90,75,90,100,teeth_whitening,"28–40 years old. Drinks 2–4 cups of coffee daily. Has professional video calls, a curated LinkedIn/Instagram presence, a"
2,The Intentional Dog Parent,Health Outcome Loop,3,100,"One chew a day. Cleaner teeth, healthier gut, shinier coat. No artificial anything. Vet-reviewed.",3-in-1 Functional Chew: Dental + Digestive + Coat Health,A single soft chew format (daily) that layers three ingredients: (1) dental enzymes to break down plaque biofilm; (2) prebiotic chicory root for gut microbiome support; (3) omega-3 fish oil for coat q,"A treat brand that is a health supplement delivery system first, a reward second. Each treat has a documented health function: dental enzyme, prebiotic fiber, or omega-3.","Treats contain artificial preservatives, dyes, and unidentified 'meat by-products' | Dog's breath is noticeably bad after most treat brands | Dog has loose stools or digestive upset tied to treat ingredients","All three problems are caused by the same root: artificial ingredients in mass-market treats. Solving the ingredient problem (clean, functional) solves all three simultaneously. No brand currently pos",~$9B US dog food/treat market,Amazon commodity products — 0% suspicious review rate,85,95,90,72,92,100,dog_treats,28–42 years old. Treats their dog as a family member. Anxious about ingredient lists. Follows dog training content on Ti
3,The Home Yoga + Strength Woman,The Grip-Strength-Recovery Triangle,4,100,The first kit that connects your yoga practice to your strength training. One mat. One system. Zero excuses.,The Complete Home Practice System,"One kit: (1) non-slip microfiber hot yoga towel with silicone grip dots and integrated resistance band anchor loops at the base; (2) 3 premium fabric glute resistance bands (no snap, no roll, progress","An integrated physical practice kit where grip, resistance, and recovery are all addressed in a single branded system — not three separate commodity purchases.",Mat slips during hot yoga — loses alignment mid-flow | Resistance bands snap or roll during leg and glute exercises | Recovery is neglected — soreness causes skipped sessions,"These three physical failures occur within the same practice week and each breaks the habit loop: slipping breaks flow, snapping bands create frustration, soreness prevents the next session. Solving a",~$1.7B (yoga $600M + home fitness $1.1B),Amazon commodity products — 60% suspicious review rate,85,90,92,75,90,32,"yoga_mats, resistance_bands",28–42 years old. Practices yoga 2–3x per week and does resistance training at home 3x per week. Limited space. Has drift
4,The Morning Wellness Ritualist,The Disconnected Routine Problem,4,100,"The first brand built around your morning, not around a product. From teeth to mat to candlelight — one ritual, one brand.",The Morning Ritual Brand,"Brand architecture: three product lines, one ritual. Line 1 (Brighten): sensitivity-safe whitening pen + remineralizing tooth serum. Line 2 (Move): hot yoga grip towel + travel mat. Line 3 (Ground): 3","A brand that treats the morning routine as a single system: the 45-minute ritual from waking to starting the day. Products designed around the sequence, not the category.",Morning routine has 6–8 different brands that feel disconnected | No single brand understands the whole morning ritual | No cohesive 'morning ritual brand' at a premium but accessible price,"This customer's willingness to pay is high but her attention span for discovery is low. She buys from brands she trusts, not from categories. A brand that owns 'morning ritual products' across oral ca",~$2.9B (wellness routine products),Amazon commodity products — 55% suspicious review rate,82,95,95,55,98,88,"teeth_whitening, yoga_mats, candles","30–42 years old. Wakes at 6am. Follows a morning routine: yoga, matcha or coffee, journaling, or some combination. Her h"
5,The Self-Image Professional,The Sensitivity–Confidence Trap,3,98.5,The first whitening strip that makes your enamel stronger while it whitens. No sensitivity. No compromise.,Whitening + Remineralizing Dual-Layer Strip,A strip with two functional layers: an outer whitening layer (7% hydrogen peroxide) and an inner remineralizing layer (hydroxyapatite + calcium) that activates on contact with teeth. The enamel protec,A whitening product that actively strengthens enamel while whitening — addressing the fear of damage directly in the product mechanism.,"Whitening strips cause sharp tooth sensitivity for 24–48 hours | Feels self-conscious smiling in video calls, photos, first dates | Peroxide fear: worried about long-term enamel erosion",The very product meant to fix the confidence problem creates a physical pain problem. Most customers stop whitening treatments not because they're satisfied but because they can't tolerate the sensiti,~$1.8B US oral beauty,Amazon commodity products — 83% suspicious review rate,92,60,88,80,92,100,teeth_whitening,"28–40 years old. Drinks 2–4 cups of coffee daily. Has professional video calls, a curated LinkedIn/Instagram presence, a"
6,The Intentional Dog Parent,Training Effectiveness Stack,3,98.0,"The two-tier treat system built for the science of reinforcement. The right treat, at the right moment, every time.",The Training Treat Duo (Low-Value + High-Value System),"Two-SKU training system sold together: (1) micro-treats, 1.5 calories each, freeze-dried single ingredient (chicken or salmon), 500+ per bag for high-frequency training; (2) jackpot treats, high-aroma","A training treat duo: tiny, low-calorie 'rep treats' for repetitions + a high-value 'jackpot treat' for breakthrough moments. Delivered in a ratio based on dog size and training frequency.","Training treats are too large — 300 repetitions in a session depletes a bag | Different 'value' treats needed (high-value for distractions, low-value for repetitions) | Running out of treats mid-session derails training progress",Effective dog training requires both high-frequency low-value treats (for repetitions) and high-value treats (for breaking attention from distractions). No product exists as a dual-tier training syste,~$9B US dog food/treat market,Amazon commodity products — 0% suspicious review rate,82,90,88,70,85,100,dog_treats,28–42 years old. Treats their dog as a family member. Anxious about ingredient lists. Follows dog training content on Ti
7,The Home Yoga + Strength Woman,The Glute-Specific Training Gap,3,97.6,"Bands built for glutes, not for everything. 12 weeks of progressive programming included.",The Glute Lab Home Training System,"3 fabric bands designed specifically for glute exercises (wider than standard, silicone-grip inner lining, hip-flexion optimized resistance levels). Includes: 12-week progressive glute program (QR cod","Bands designed specifically for glute activation patterns: wider width (more surface area), anti-roll grip texture, and resistance levels calibrated to glute strength curves.",Generic loop bands don't target glutes specifically | Resistance bands snap or roll during leg and glute exercises | No progressive structure — plateaus without a defined program,"Women's home fitness is overwhelmingly glute-goal-oriented, but 100% of the top resistance band products are generic '5-band sets for everyone.' A glute-specific system with appropriate resistance lev",~$1.7B (yoga $600M + home fitness $1.1B),Amazon commodity products — 60% suspicious review rate,88,88,88,68,88,32,"yoga_mats, resistance_bands",28–42 years old. Practices yoga 2–3x per week and does resistance training at home 3x per week. Limited space. Has drift
8,The Intentional Dog Parent,The Anxious Owner Trust Gap,3,95.7,"The only dog treat subscription that knows your dog's name, weight, and health goals before the first bag ships.",The Personalized Dog Health Subscription,"Onboarding quiz: dog weight, breed, age, current health goals (training? dental? digestion? anxiety?). Monthly box ships the right treat formulations in the right quantities. Includes a monthly 'what ","A subscription that adapts: dog size intake, life stage, training goals, and health priorities. First purchase includes a dog health questionnaire.","Premium treat brands exist but $40+ bags feel like a gamble without proof | No single treat addresses both training reward AND health benefit | Subscription boxes are not customized to the dog's size, needs, or training stage",Dog parents willing to spend premium have no brand that earns their trust with transparency AND customization. Every subscription box sends the same treats regardless of dog. This creates churn.,~$9B US dog food/treat market,Amazon commodity products — 0% suspicious review rate,78,85,85,68,95,100,dog_treats,28–42 years old. Treats their dog as a family member. Anxious about ingredient lists. Follows dog training content on Ti
9,The Self-Image Professional,The Trust Vacuum,3,94.6,5 minutes. No removal. Every ingredient explained. Or your money back.,Transparent Whitening Co. (5-Minute Strips),New-generation flexible strips that adhere to the tooth contour and dissolve in 5 minutes with no removal needed. Brand built on: (1) QR-code ingredient transparency; (2) a 30-day results guarantee wi,"A whitening brand that leads with radical transparency: published clinical results, ingredient disclosure, and a product design that respects the user's time (5-minute format, stays on).","Cannot trust whitening brand claims (fake reviews everywhere) | Strips fall off teeth, especially on lower row | Treatment timing is inconvenient (30 min with strips in = can't drink coffee)","83% of ranked whitening products have suspicious review integrity. Consumers have been burned by products that didn't work as claimed. Combined with physical inconveniences, this creates mass churn an",~$1.8B US oral beauty,Amazon commodity products — 83% suspicious review rate,80,60,85,82,88,100,teeth_whitening,"28–40 years old. Drinks 2–4 cups of coffee daily. Has professional video calls, a curated LinkedIn/Instagram presence, a"
10,The Home Entertainer,The Cocktail Presentation System,4,94.2,"Sphere ice, herb infusion, matching straws, 30 recipes. Everything you need to look like you know what you're doing.",The Slow Ice Cocktail System,Kit: (1) large sphere ice mold (leak-proof via silicone seal) with an inner herb/fruit infusion chamber; (2) small cocktail cube tray for highball drinks; (3) matching glass straws in a color that com,A cocktail ice system that makes every drink look effortless: sphere ice + infusion insert + garnish preparation included in one kit that takes under 3 minutes to deploy.,Regular ice dilutes expensive spirits and cocktails within minutes | Cocktail presentation looks basic compared to bar-quality drinks on TikTok | Infusing drinks with herbs/fruits requires specialist equipment,"All three problems are about the same moment: the reveal of the drink to a guest. Slow-melt sphere ice, a citrus peel garnish, and a herb-infused cube all address the same 30-second window of drink pr",~$330M cocktail accessories + eco drinkware,Amazon commodity products — 48% suspicious review rate,78,72,90,65,88,25,"ice_cube_molds, reusable_straws","30–45 years old. Hosts dinner parties and cocktail nights regularly. Follows cocktail TikTok, wants to impress guests wi"
11,The Home Yoga + Strength Woman,The Commitment-Identity Gap,3,93.8,Studio quality at home. Because your practice is real whether or not you pay studio rent.,Studio-Grade Home Practice Brand,"Premium positioning ($75–$95 kit) with materials that signal quality: natural rubber mat base, organic cotton towel layer, woven fabric resistance bands. Includes access to a private practice communit","A brand that treats the home practitioner as a serious athlete, not a casual fitness consumer. The product should feel like studio-grade equipment for the home.",Home practice feels less 'real' than going to a studio | No accountability — motivation drops without community | No progressive structure — plateaus without a defined program,"This customer is committed in identity ('I'm a yogi') but the physical environment (generic Amazon gear, no structure) doesn't match the identity. Premium products signal seriousness to the self — thi",~$1.7B (yoga $600M + home fitness $1.1B),Amazon commodity products — 60% suspicious review rate,78,85,85,65,94,32,"yoga_mats, resistance_bands",28–42 years old. Practices yoga 2–3x per week and does resistance training at home 3x per week. Limited space. Has drift
12,The Morning Wellness Ritualist,The Aesthetics-Function Mismatch,3,93.8,"Your mat and your ambiance, designed together. Because your practice space is intentional.",The Wellness Aesthetic System,"Matched product pair designed for the same visual space: (1) natural rubber yoga mat in earthy tones (sage, terracotta) with integrated non-slip pattern; (2) ceramic tealight holder set in the same pa",Wellness tools that are designed by a creative director AND a materials engineer simultaneously. The yoga mat should feel like it belongs next to the candles.,"Products that work don't look good; products that look good don't work | Yoga mat is functional but doesn't match the aesthetic of the wellness space | Candles/ambiance are afterthoughts, not designed for morning practice","Premium wellness buyers face a consistent binary: beautiful products underperform, high-performance products are ugly. The opportunity is a brand that dissolves this binary — equal emphasis on materia",~$2.9B (wellness routine products),Amazon commodity products — 55% suspicious review rate,75,80,88,52,92,88,"teeth_whitening, yoga_mats, candles","30–42 years old. Wakes at 6am. Follows a morning routine: yoga, matcha or coffee, journaling, or some combination. Her h"
13,The Home Decor Curator,The Seasonal Aesthetic Transition,3,92.6,"Your home, updated with the season. Four times a year, without shopping.",The Seasonal Home Edit (Quarterly Decor Subscription),"Quarterly subscription: each edit contains 6 tealight holders in a seasonal palette (matte terracotta for fall, frosted glass for winter, natural rattan for spring, minimal ceramic for summer). Design",A brand that ships a cohesive seasonal 'home edit' of tealight holders and accessories quarterly — so the home transforms with the season without requiring the customer to shop or research.,Tealight holders are either cheap/flimsy or over-designed for formal events | Seasonal decor accumulates clutter; no system for transitioning aesthetics | The 'aesthetic home' TikTok trend creates aspiration but no obvious brand to shop,The 12/15 candle holder products under 1K reviews proves there is no dominant brand in this space. A brand that owns 'seasonal home aesthetic edits' could capture repeat purchasers without ever compet,~$500M candle accessories + home fragrance,Amazon commodity products — 0% suspicious review rate,70,85,90,60,95,65,candles,26–38 years old. Curates their home environment intentionally. Shops for home decor seasonally. Gives home decor gifts. 
14,The Eco-Minimalist Hydration Person,The Bottle-Specific Replacement Ecosystem,3,91.0,The only straw brand that knows which bottle you own. Ships straws that actually fit.,The Bottle-Matched Straw Subscription,"Brand built around bottle compatibility: customer selects their bottle model during signup. Receives 4 matched straws (2 glass + 2 metal or silicone), cleaning brush, and carry pouch. Every 3 months: ","A replacement straw brand that maps products to specific bottle models — Owala 24oz, Stanley 30oz, Hydro Flask 32oz — with a subscription that auto-replenishes.","Replacement straws for specific bottles (Owala, Stanley) hard to find | Single straw purchase feels insufficient; lose one, the set is incomplete | Subscription model doesn't exist for replacement straws","The XZESH metal straw for Owala is doing $5,475/mo with clean integrity and fewer than 1K reviews. The validated demand is real and no brand has built an ecosystem around bottle-specific replacement a",~$130M eco drinkware segment,Amazon commodity products — 56% suspicious review rate,72,75,90,68,85,30,reusable_straws,24–36 years old. Owns a Stanley or Owala water bottle. Drinks water and smoothies habitually. Eco-conscious but not extr
15,The Aesthetic Home Chef,The Content Creator's Kitchen Problem,3,89.5,Three tools that look as good in your content as they work in your kitchen.,The Food Creator Kitchen Trio,"3 tools curated for how they look ON camera, not just how they function: (1) matte stainless spatula with olive wood handle; (2) matching whisk; (3) silicone spoon in seasonal color. Sold with a 'how ","A 'creator kitchen kit' — 3–5 tools photographed specifically in real cooking content, sold with a style guide showing how to use them as props.",Cooking content requires aesthetically interesting tools as visual props | Generic black/gray silicone looks cheap and doesn't photograph well | No minimalist 'essentials only' option — everything sold as big sets,Food content creation is one of the fastest growing creator niches. Creators need tools that are props as much as they are functional. A 33-piece set clutters the frame. A curated 3-piece set becomes ,~$1.4B kitchen tools + protection,Amazon commodity products — 78% suspicious review rate,72,75,88,58,90,20,"cooking_utensils, potholders","28–42 years old. Cooks seriously at home. Has a food TikTok or Instagram, or aspires to. Frustrated by generic black sil"
16,The Aesthetic Home Chef,The Aesthetic Kitchen Identity Gap,3,89.1,Your kitchen has a wardrobe. These are the essentials. Pick your palette. Own the whole collection.,The Kitchen Capsule Brand,"Annual seasonal collections (Sage, Terracotta, Slate) covering 5 essential utensils + a 2-piece oven mitt set. All stainless steel core with swappable silicone heads (utensils) and matching linen/sili","A premium kitchen aesthetic brand where every piece in a collection matches: spatula, spoon, tongs, oven mitts, pot holders — all in the same material palette and color story. Designed to look beautiful hanging in a kitchen.",Generic black/gray silicone looks cheap and doesn't photograph well | Matching kitchen tools and mitts requires buying from multiple brands | Can't find a kitchen brand with an aesthetic identity worth gifting,"The home chef who cares about kitchen aesthetics cannot find a single brand that covers both tools and protection in a matched visual system. The gap is a brand identity gap, not a product gap. 78% of",~$1.4B kitchen tools + protection,Amazon commodity products — 78% suspicious review rate,75,60,92,65,96,20,"cooking_utensils, potholders","28–42 years old. Cooks seriously at home. Has a food TikTok or Instagram, or aspires to. Frustrated by generic black sil"
17,The Home Decor Curator,The Gifting Confidence Gap,3,87.6,A home gift that needs no knowledge of their taste. Minimal enough to match anything. Beautiful enough to display.,The Gift-Ready Home Candle Set,"Set of 4 minimal geometric tealight holders (matte ceramic, neutral palette) with 10 unscented soy tealights included. Presented in a kraft gift box with a hand-written card insert. Can be personalize","A gifting brand for home decor that sits at the $28–$45 price point, looks premium, and requires zero knowledge of the recipient's tastes — because the design is neutral enough to fit any aesthetic.",Buying candles as gifts is risky — scent preferences are deeply personal | Gifting home decor feels impersonal without a clear brand story | Current options are either luxury-priced ($80+) or quality-compromised (<$15),Gift givers want to spend $25–$45 on something that looks premium and feels personal without the scent risk. A candle HOLDER brand at that price point — with a brand story — eliminates the scent risk ,~$500M candle accessories + home fragrance,Amazon commodity products — 0% suspicious review rate,72,60,88,72,90,65,candles,26–38 years old. Curates their home environment intentionally. Shops for home decor seasonally. Gives home decor gifts. 
18,The Aesthetic Home Chef,The Safety + Aesthetics Mismatch,3,87.5,"932°F rated. Beautiful enough to display. Built for cast iron, not just for show.",The Cast Iron Cook's Protection Set,Long-form silicone oven mitt (rated 932°F) with a linen exterior shell in seasonal color. Includes matching trivets. Designed specifically for cast iron and Dutch oven cooking. Certifications (heat ra,A premium oven mitt that is rated to 932°F AND beautiful enough to hang on display in a styled kitchen. The product needs to pass both a safety test and a photography test.,"Oven mitts fail above 400°F, creating safety risk for cast iron use | Cheap mitts deteriorate visually after 3–4 washes | Kitchen cluttered with 28 useless tools from 33-piece sets","The home chef who uses cast iron or does high-heat baking is under-served: generic mitts aren't rated for the temperatures involved, and they look terrible. The safety need and the aesthetic need are ",~$1.4B kitchen tools + protection,Amazon commodity products — 78% suspicious review rate,80,65,85,55,88,20,"cooking_utensils, potholders","28–42 years old. Cooks seriously at home. Has a food TikTok or Instagram, or aspires to. Frustrated by generic black sil"
19,The Home Decor Curator,The Ambient Scent Control Gap,3,86.1,Dinner-length fragrance. No overpowering room scent. Refill monthly.,The Dinner Table Scent System,"6 aesthetic holders + 24 scented soy tealights in 4 seasonal scents (2 tealights per scent × 4 dinners). Scents are food-complementary: citrus for summer meals, spice for winter, herbal for spring gat","A micro-fragrance system: small, controlled scent via scented tealights in beautiful holders that burns for 4 hours (dinner length), not 40 hours (full candle).",Fragrance in a room is either too strong (entire candle) or non-existent | Setting up for dinner parties requires sourcing from 5 different places | No subscription or 'edit' model for home accessories — everything is one-time,"The home entertainer wants ambient scent but not the full candle experience (wax, flame management, burning time). Tealights in aesthetic holders solve the ambient issue but no brand has positioned ar",~$500M candle accessories + home fragrance,Amazon commodity products — 0% suspicious review rate,68,70,85,58,88,65,candles,26–38 years old. Curates their home environment intentionally. Shops for home decor seasonally. Gives home decor gifts. 
20,The Home Entertainer,The Eco Aesthetic Mismatch,3,84.9,"A glass straw for every drink. Designed to be seen, not hidden.",The Glass Straw Collection (By Drink Type),3-pack glass straws curated by drink occasion: (1) clear straight 8mm for spirits; (2) colored angled 10mm for cocktails; (3) wide 14mm for thick drinks. Each straw has a matching silicone tip and cle,"A glass straw collection designed to match drink aesthetics: clear for spirits, tinted for cocktails, wide for smoothies. Sold as a set that visually belongs together.",Reusable straws don't match the aesthetic of the drink they're served in | Plastic straws are embarrassing to use but metal straws taste metallic | No cohesive 'home bar' system — mismatched tools collected over time,The eco-conscious host is caught between environmental values (no plastic) and sensory experience (metal tastes wrong) and aesthetic values (random straws don't match the drink). Glass straws solve ta,~$330M cocktail accessories + eco drinkware,Amazon commodity products — 48% suspicious review rate,70,65,85,60,82,25,"ice_cube_molds, reusable_straws","30–45 years old. Hosts dinner parties and cocktail nights regularly. Follows cocktail TikTok, wants to impress guests wi"
